{"branch_provenance":[{"attempt":0,"cause":"","continuation":null,"core":"newton","core_outcome":"CONVERGED","decision":"converged","initializer_source":"traversal-G0-v1","iterations":5,"opening_source":"initializer","opening_state_sha256":"26ff18c8e68df72e86101c00c653b40cfa02c3cd376353eb56cfbb7e090a67ff","opening_trial":null,"signature":[["U-HEAT","TWO_PHASE"],["U-PHF","TWO_PHASE"]]}],"certificate_id":"cert-bc8401d3a186","check_policy_id":"K04-check-policy-v1","check_policy_sha256":"21c44e105a1b78428047258af3030b8502957aab5d27f0389c2f143bcb3cf390","checks":[{"category":"residual","id":"residual.U-FEED:FEED-n:A","independence_qualification":null,"near_threshold":false,"reason":"","reference":3,"result":"pass","scope":"evaluated","subject":"U-FEED:FEED-n:A","tolerance":3.1000000000000006e-8,"value":0},{"category":"residual","id":"residual.U-FEED:FEED-n:B","independence_qualification":null,"near_threshold":false,"reason":"","reference":3,"result":"pass","scope":"evaluated","subject":"U-FEED:FEED-n:B","tolerance":3.1000000000000006e-8,"value":0},{"category":"residual","id":"residual.U-FEED:FEED-n:C","independence_qualification":null,"near_threshold":false,"reason":"","reference":3,"result":"pass","scope":"evaluated","subject":"U-FEED:FEED-n:C","tolerance":3.1000000000000006e-8,"value":0},{"category":"residual","id":"residual.U-FEED:FEED-T","independence_qualification":null,"near_threshold":false,"reason":"","reference":100,"result":"pass","scope":"evaluated","subject":"U-FEED:FEED-T","tolerance":0.000001,"value":0},{"category":"residual","id":"residual.U-FEED:FEED-P","independence_qualification":null,"near_threshold":false,"reason":"","reference":100000,"result":"pass","scope":"evaluated","subject":"U-FEED:FEED-P","tolerance":0.01,"value":0},{"category":"residual","id":"residual.U-MIX:MIX-mole:A","independence_qualification":null,"near_threshold":false,"reason":"","reference":3,"result":"pass","scope":"evaluated","subject":"U-MIX:MIX-mole:A","tolerance":3.1000000000000006e-8,"value":0},{"category":"residual","id":"residual.U-MIX:MIX-mole:B","independence_qualification":null,"near_threshold":false,"reason":"","reference":3,"result":"pass","scope":"evaluated","subject":"U-MIX:MIX-mole:B","tolerance":3.1000000000000006e-8,"value":0},{"category":"residual","id":"residual.U-MIX:MIX-mole:C","independence_qualification":null,"near_threshold":false,"reason":"","reference":3,"result":"pass","scope":"evaluated","subject":"U-MIX:MIX-mole:C","tolerance":3.1000000000000006e-8,"value":0},{"category":"residual","id":"residual.U-MIX:MIX-energy","independence_qualification":null,"near_threshold":true,"reason":"","reference":100000,"result":"pass","scope":"evaluated","subject":"U-MIX:MIX-energy","tolerance":0.00101,"value":-0.0001458089827792719},{"category":"residual","id":"residual.U-MIX:MIX-pressure:0","independence_qualification":null,"near_threshold":false,"reason":"","reference":100000,"result":"pass","scope":"evaluated","subject":"U-MIX:MIX-pressure:0","tolerance":0.01,"value":0},{"category":"residual","id":"residual.U-MIX:MIX-pressure:1","independence_qualification":null,"near_threshold":false,"reason":"","reference":100000,"result":"pass","scope":"evaluated","subject":"U-MIX:MIX-pressure:1","tolerance":0.01,"value":0},{"category":"residual","id":"residual.U-HEAT:HEAT-mole:A","independence_qualification":null,"near_threshold":false,"reason":"","reference":3,"result":"pass","scope":"evaluated","subject":"U-HEAT:HEAT-mole:A","tolerance":3.1000000000000006e-8,"value":0},{"category":"residual","id":"residual.U-HEAT:HEAT-mole:B","independence_qualification":null,"near_threshold":false,"reason":"","reference":3,"result":"pass","scope":"evaluated","subject":"U-HEAT:HEAT-mole:B","tolerance":3.1000000000000006e-8,"value":0},{"category":"residual","id":"residual.U-HEAT:HEAT-mole:C","independence_qualification":null,"near_threshold":false,"reason":"","reference":3,"result":"pass","scope":"evaluated","subject":"U-HEAT:HEAT-mole:C","tolerance":3.1000000000000006e-8,"value":0},{"category":"residual","id":"residual.U-HEAT:HEAT-T","independence_qualification":null,"near_threshold":false,"reason":"","reference":100,"result":"pass","scope":"evaluated","subject":"U-HEAT:HEAT-T","tolerance":0.000001,"value":0},{"category":"residual","id":"residual.U-HEAT:HEAT-pressure","independence_qualification":null,"near_threshold":false,"reason":"","reference":100000,"result":"pass","scope":"evaluated","subject":"U-HEAT:HEAT-pressure","tolerance":0.01,"value":0},{"category":"residual","id":"residual.U-HEAT:HEAT-duty","independence_qualification":null,"near_threshold":true,"reason":"","reference":100000,"result":"pass","scope":"evaluated","subject":"U-HEAT:HEAT-duty","tolerance":0.00101,"value":0.00017384722013957798},{"category":"residual","id":"residual.U-HEAT:HEAT-equilibrium:A","independence_qualification":null,"near_threshold":false,"reason":"","reference":9,"result":"pass","scope":"evaluated","subject":"U-HEAT:HEAT-equilibrium:A","tolerance":9.3e-8,"value":1.8613910413023405e-10},{"category":"residual","id":"residual.U-HEAT:split:A","independence_qualification":null,"near_threshold":false,"reason":"","reference":3,"result":"pass","scope":"evaluated","subject":"U-HEAT:split:A","tolerance":3.1000000000000006e-8,"value":0},{"category":"residual","id":"residual.U-HEAT:HEAT-equilibrium:B","independence_qualification":null,"near_threshold":false,"reason":"","reference":9,"result":"pass","scope":"evaluated","subject":"U-HEAT:HEAT-equilibrium:B","tolerance":9.3e-8,"value":-2.400173393368732e-10},{"category":"residual","id":"residual.U-HEAT:split:B","independence_qualification":null,"near_threshold":false,"reason":"","reference":3,"result":"pass","scope":"evaluated","subject":"U-HEAT:split:B","tolerance":3.1000000000000006e-8,"value":0},{"category":"residual","id":"residual.U-HEAT:HEAT-equilibrium:C","independence_qualification":null,"near_threshold":false,"reason":"","reference":9,"result":"pass","scope":"evaluated","subject":"U-HEAT:HEAT-equilibrium:C","tolerance":9.3e-8,"value":5.387712498361452e-11},{"category":"residual","id":"residual.U-HEAT:split:C","independence_qualification":null,"near_threshold":false,"reason":"","reference":3,"result":"pass","scope":"evaluated","subject":"U-HEAT:split:C","tolerance":3.1000000000000006e-8,"value":-1.7763568394002505e-15},{"category":"residual","id":"residual.U-HEAT:Vdef","independence_qualification":null,"near_threshold":false,"reason":"","reference":3,"result":"pass","scope":"evaluated","subject":"U-HEAT:Vdef","tolerance":3.1000000000000006e-8,"value":5.551115123125783e-17},{"category":"residual","id":"residual.U-HEAT:Ldef","independence_qualification":null,"near_threshold":false,"reason":"","reference":3,"result":"pass","scope":"evaluated","subject":"U-HEAT:Ldef","tolerance":3.1000000000000006e-8,"value":0},{"category":"residual","id":"residual.U-PHF:PHF-mole:A","independence_qualification":null,"near_threshold":false,"reason":"","reference":3,"result":"pass","scope":"evaluated","subject":"U-PHF:PHF-mole:A","tolerance":3.1000000000000006e-8,"value":0},{"category":"residual","id":"residual.U-PHF:PHF-mole:B","independence_qualification":null,"near_threshold":false,"reason":"","reference":3,"result":"pass","scope":"evaluated","subject":"U-PHF:PHF-mole:B","tolerance":3.1000000000000006e-8,"value":0},{"category":"residual","id":"residual.U-PHF:PHF-mole:C","independence_qualification":null,"near_threshold":false,"reason":"","reference":3,"result":"pass","scope":"evaluated","subject":"U-PHF:PHF-mole:C","tolerance":3.1000000000000006e-8,"value":-1.7763568394002505e-15},{"category":"residual","id":"residual.U-PHF:PHF-equilibrium:A","independence_qualification":null,"near_threshold":false,"reason":"","reference":9,"result":"pass","scope":"evaluated","subject":"U-PHF:PHF-equilibrium:A","tolerance":9.3e-8,"value":3.75118958118037e-9},{"category":"residual","id":"residual.U-PHF:PHF-equilibrium:B","independence_qualification":null,"near_threshold":false,"reason":"","reference":9,"result":"pass","scope":"evaluated","subject":"U-PHF:PHF-equilibrium:B","tolerance":9.3e-8,"value":-1.4780523471813467e-9},{"category":"residual","id":"residual.U-PHF:PHF-equilibrium:C","independence_qualification":null,"near_threshold":false,"reason":"","reference":9,"result":"pass","scope":"evaluated","subject":"U-PHF:PHF-equilibrium:C","tolerance":9.3e-8,"value":-2.8015949560256104e-9},{"category":"residual","id":"residual.U-PHF:PHF-T","independence_qualification":null,"near_threshold":false,"reason":"","reference":100,"result":"pass","scope":"evaluated","subject":"U-PHF:PHF-T","tolerance":0.000001,"value":0},{"category":"residual","id":"residual.U-PHF:PHF-pressure:vapor","independence_qualification":null,"near_threshold":false,"reason":"","reference":100000,"result":"pass","scope":"evaluated","subject":"U-PHF:PHF-pressure:vapor","tolerance":0.01,"value":0},{"category":"residual","id":"residual.U-PHF:PHF-pressure:liquid","independence_qualification":null,"near_threshold":false,"reason":"","reference":100000,"result":"pass","scope":"evaluated","subject":"U-PHF:PHF-pressure:liquid","tolerance":0.01,"value":0},{"category":"residual","id":"residual.U-PHF:PHF-duty","independence_qualification":null,"near_threshold":false,"reason":"","reference":100000,"result":"pass","scope":"evaluated","subject":"U-PHF:PHF-duty","tolerance":0.00101,"value":-0.000028038251912221313},{"category":"residual","id":"residual.U-PHF:PHF-Q","independence_qualification":null,"near_threshold":false,"reason":"","reference":100000,"result":"pass","scope":"evaluated","subject":"U-PHF:PHF-Q","tolerance":0.00101,"value":0},{"category":"residual","id":"residual.U-PHF:Ndef:vapor","independence_qualification":null,"near_threshold":false,"reason":"","reference":3,"result":"pass","scope":"evaluated","subject":"U-PHF:Ndef:vapor","tolerance":3.1000000000000006e-8,"value":1.3877787807814457e-16},{"category":"residual","id":"residual.U-PHF:Ndef:liquid","independence_qualification":null,"near_